[
  {
    "artifact": {
      "entrypoint": "chemistry/bonding/explorers/chemical_bonding/index.html",
      "generated": false
    },
    "audience": "LEARNER",
    "classification": {
      "capability_refs": [
        "MIC-CHEM-BONDING"
      ],
      "subject_ref": "Chemistry",
      "topic_refs": [
        "chem.bonding"
      ]
    },
    "id": "chem.bonding.chemical-bonding.explorer",
    "learner_role": "EXPLORE",
    "platform_capabilities": [
      "interactive",
      "simulation",
      "visual-engine"
    ],
    "presentation": "COMPANION",
    "resource_kind": "OPAQUE_APP",
    "schema": "grade9v3-resource/v1",
    "search": {
      "aliases": [
        "chemical bonding",
        "vsepr",
        "lewis structures",
        "dipole"
      ],
      "title": "Chemical Bonding & Molecular Structure Explorer",
      "visibility": "LEARNER"
    },
    "source": {
      "authority_ref": null,
      "generator_ref": null
    },
    "validation": {
      "academic_evidence_ref": null,
      "browser_evidence_ref": null,
      "publication_evidence_ref": null,
      "structural_evidence_ref": null
    }
  },
  {
    "artifact": {
      "entrypoint": "chemistry/bonding/core1a.html",
      "generated": true
    },
    "audience": "LEARNER",
    "classification": {
      "capability_refs": [
        "MIC-CHEM-BONDING"
      ],
      "subject_ref": "Chemistry",
      "topic_refs": [
        "chem.bonding"
      ]
    },
    "id": "chem.bonding.core1a",
    "learner_role": "LEARN",
    "platform_capabilities": [
      "staged-representation",
      "worked-anchor",
      "related-practice"
    ],
    "presentation": "FULL_PAGE",
    "resource_kind": "STRUCTURED_PRODUCT",
    "schema": "grade9v3-resource/v1",
    "search": {
      "aliases": [
        "chemical bonding",
        "vsepr",
        "molecular geometry",
        "bonding core1a"
      ],
      "title": "Chemical Bonding \u00b7 VSEPR & Geometry \u2014 Learn",
      "visibility": "LEARNER"
    },
    "source": {
      "authority_ref": "chemistry/bonding/core1a.html",
      "generator_ref": "Shared/tools/build_learner_ui.py"
    },
    "validation": {
      "academic_evidence_ref": null,
      "browser_evidence_ref": null,
      "publication_evidence_ref": null,
      "structural_evidence_ref": null
    }
  },
  {
    "artifact": {
      "entrypoint": "chemistry/gases/explorers/behaviour_of_gases/index.html",
      "generated": false
    },
    "audience": "LEARNER",
    "classification": {
      "capability_refs": [
        "MIC-CHEM-GAS-LAWS"
      ],
      "subject_ref": "Chemistry",
      "topic_refs": [
        "chem.gases"
      ]
    },
    "id": "chem.gases.behaviour-of-gases.explorer",
    "learner_role": "EXPLORE",
    "platform_capabilities": [
      "interactive",
      "simulation",
      "visual-engine"
    ],
    "presentation": "COMPANION",
    "resource_kind": "OPAQUE_APP",
    "schema": "grade9v3-resource/v1",
    "search": {
      "aliases": [
        "gas laws",
        "ideal gas",
        "maxwell speed distribution"
      ],
      "title": "Behaviour of Gases Explorer",
      "visibility": "LEARNER"
    },
    "source": {
      "authority_ref": null,
      "generator_ref": null
    },
    "validation": {
      "academic_evidence_ref": null,
      "browser_evidence_ref": null,
      "publication_evidence_ref": null,
      "structural_evidence_ref": null
    }
  },
  {
    "artifact": {
      "entrypoint": "chemistry/some-basic-concepts/explorers/mole_concept/index.html",
      "generated": false
    },
    "audience": "LEARNER",
    "classification": {
      "capability_refs": [
        "MIC-CHEM-MOLE-CONCEPT"
      ],
      "subject_ref": "Chemistry",
      "topic_refs": [
        "chem.mole"
      ]
    },
    "id": "chem.mole.mole-concept.explorer",
    "learner_role": "EXPLORE",
    "platform_capabilities": [
      "interactive",
      "simulation",
      "visual-engine"
    ],
    "presentation": "COMPANION",
    "resource_kind": "OPAQUE_APP",
    "schema": "grade9v3-resource/v1",
    "search": {
      "aliases": [
        "mole concept",
        "stoichiometry",
        "limiting reagent"
      ],
      "title": "Mole Concept & Stoichiometry Explorer",
      "visibility": "LEARNER"
    },
    "source": {
      "authority_ref": null,
      "generator_ref": null
    },
    "validation": {
      "academic_evidence_ref": null,
      "browser_evidence_ref": null,
      "publication_evidence_ref": null,
      "structural_evidence_ref": null
    }
  },
  {
    "artifact": {
      "entrypoint": "chemistry/redox/explorers/redox_reactions/index.html",
      "generated": false
    },
    "audience": "LEARNER",
    "classification": {
      "capability_refs": [
        "MIC-CHEM-REDOX"
      ],
      "subject_ref": "Chemistry",
      "topic_refs": [
        "chem.redox"
      ]
    },
    "id": "chem.redox.redox-reactions.explorer",
    "learner_role": "EXPLORE",
    "platform_capabilities": [
      "interactive",
      "simulation",
      "visual-engine"
    ],
    "presentation": "COMPANION",
    "resource_kind": "OPAQUE_APP",
    "schema": "grade9v3-resource/v1",
    "search": {
      "aliases": [
        "redox",
        "oxidation states",
        "electron transfer"
      ],
      "title": "Redox Reactions Explorer",
      "visibility": "LEARNER"
    },
    "source": {
      "authority_ref": null,
      "generator_ref": null
    },
    "validation": {
      "academic_evidence_ref": null,
      "browser_evidence_ref": null,
      "publication_evidence_ref": null,
      "structural_evidence_ref": null
    }
  },
  {
    "artifact": {
      "entrypoint": "chemistry/index.html",
      "generated": false
    },
    "audience": "LEARNER",
    "classification": {
      "capability_refs": [],
      "subject_ref": "Chemistry",
      "topic_refs": []
    },
    "id": "chemistry.home",
    "learner_role": "LEARN",
    "platform_capabilities": [
      "subject-hub",
      "topic-index"
    ],
    "presentation": "FULL_PAGE",
    "resource_kind": "STRUCTURED_PRODUCT",
    "schema": "grade9v3-resource/v1",
    "search": {
      "aliases": [
        "chemistry",
        "chemistry hub"
      ],
      "title": "Chemistry Subject Hub",
      "visibility": "LEARNER"
    },
    "source": {
      "authority_ref": "Chemistry/adapter/CoreContracts.json",
      "generator_ref": null
    },
    "validation": {
      "academic_evidence_ref": null,
      "browser_evidence_ref": null,
      "publication_evidence_ref": null,
      "structural_evidence_ref": null
    }
  },
  {
    "artifact": {
      "entrypoint": "question-bank/index.html",
      "generated": true
    },
    "audience": "LEARNER",
    "classification": {
      "capability_refs": [],
      "subject_ref": "Common",
      "topic_refs": []
    },
    "id": "common.question-bank",
    "learner_role": "QUESTION_BANK",
    "platform_capabilities": [
      "search",
      "filter",
      "multi-tier",
      "latex-math"
    ],
    "presentation": "FULL_PAGE",
    "resource_kind": "QUESTION_COLLECTION",
    "schema": "grade9v3-resource/v1",
    "search": {
      "aliases": [
        "question bank",
        "qb",
        "past papers",
        "problems",
        "pyq"
      ],
      "title": "Question Bank",
      "visibility": "LEARNER"
    },
    "source": {
      "authority_ref": "products/question-bank/manifest.json",
      "generator_ref": "Shared/tools/build_qb_tablet_standalone.py"
    },
    "validation": {
      "academic_evidence_ref": null,
      "browser_evidence_ref": null,
      "publication_evidence_ref": null,
      "structural_evidence_ref": null
    }
  },
  {
    "artifact": {
      "entrypoint": "mathematics/vectors/core1a.html",
      "generated": true
    },
    "audience": "LEARNER",
    "classification": {
      "capability_refs": [
        "MIC-MATH-VECTOR-ALGEBRA"
      ],
      "subject_ref": "Mathematics",
      "topic_refs": [
        "math.vectors"
      ]
    },
    "id": "math.vectors.core1a",
    "learner_role": "LEARN",
    "platform_capabilities": [
      "staged-representation",
      "worked-anchor",
      "related-practice"
    ],
    "presentation": "FULL_PAGE",
    "resource_kind": "STRUCTURED_PRODUCT",
    "schema": "grade9v3-resource/v1",
    "search": {
      "aliases": [
        "vector algebra",
        "vector resolution",
        "orthogonal components",
        "vectors core1a"
      ],
      "title": "Vector Algebra \u00b7 Resolution & Components \u2014 Learn",
      "visibility": "LEARNER"
    },
    "source": {
      "authority_ref": "mathematics/vectors/core1a.html",
      "generator_ref": "Shared/tools/build_learner_ui.py"
    },
    "validation": {
      "academic_evidence_ref": null,
      "browser_evidence_ref": null,
      "publication_evidence_ref": null,
      "structural_evidence_ref": null
    }
  },
  {
    "artifact": {
      "entrypoint": "mathematics/vectors/explorers/vector_algebra/index.html",
      "generated": false
    },
    "audience": "LEARNER",
    "classification": {
      "capability_refs": [
        "MIC-MATH-VECTOR-ALGEBRA"
      ],
      "subject_ref": "Mathematics",
      "topic_refs": [
        "math.vectors"
      ]
    },
    "id": "math.vectors.vector-algebra.explorer",
    "learner_role": "EXPLORE",
    "platform_capabilities": [
      "interactive",
      "simulation",
      "visual-engine"
    ],
    "presentation": "COMPANION",
    "resource_kind": "OPAQUE_APP",
    "schema": "grade9v3-resource/v1",
    "search": {
      "aliases": [
        "vector algebra",
        "cross product",
        "dot product",
        "3d vectors"
      ],
      "title": "Vector Algebra \u00b7 3D Master Suite",
      "visibility": "LEARNER"
    },
    "source": {
      "authority_ref": null,
      "generator_ref": null
    },
    "validation": {
      "academic_evidence_ref": null,
      "browser_evidence_ref": null,
      "publication_evidence_ref": null,
      "structural_evidence_ref": null
    }
  },
  {
    "artifact": {